Excluded	liu_deep_2019	Manual Search Ren	No	Yes	No	rayyan-660618632	Deep reinforcement active learning for human-in-the-loop person re-identification	2019							6122-6131	Liu, Zimo and Wang, Jingya and Gong, Shaogang and Lu, Huchuan and Tao, Dacheng	http://openaccess.thecvf.com/content_ICCV_2019/html/Liu_Deep_Reinforcement_Active_Learning_for_Human-in-the-Loop_Person_Re-Identification_ICCV_2019_paper.html				no ER task		0	0	1	0	0	0	0	0	0	0	0	0	0	0	0	0	0	-	-
Excluded	yin_deep_2017	Manual Search Ren	No	Yes	No	rayyan-660618594	Deep Similarity-Based Batch Mode Active Learning with Exploration-Exploitation	2017	11	1	2017 IEEE International Conference on Data Mining (ICDM)	978-1-5386-3835-4			575-584	Yin, Changchang and Qian, Buyue and Cao, Shilei and Li, Xiaoyu and Wei, Jishang and Zheng, Qinghua and Davidson, Ian	http://ieeexplore.ieee.org/document/8215530/	en	IEEE		no ER task	10.1109/ICDM.2017.67	0	0	1	0	0	0	0	0	0	0	0	0	0	0	0	0	0	-	-
Excluded	zhao_deeply_2020	Manual Search Ren	No	Yes	No	rayyan-660618659	Deeply supervised active learning for finger bones segmentation	2020			42nd Annual Internation Conference of the IEEE Engineering in Medicine & Biology Society (EMBC)					Zhao, Ziyuan and Yang, X. and Veeravalli, B. and Zeng, Z.			IEEE		no ER task		0	0	1	0	0	0	0	0	0	0	0	0	0	0	0	0	0	-	-
Excluded	gissin_discriminative_2019	Manual Search Ren	No	Yes	No	rayyan-660618578	Discriminative Active Learning	2019	7	15						Gissin, Daniel and Shalev-Shwartz, Shai	http://arxiv.org/abs/1907.06347	en	arXiv		no ER task		0	0	1	0	0	0	0	0	0	0	0	0	0	0	0	0	0	-	-
Excluded	zhdanov_diverse_2019	Manual Search Ren	No	Yes	No	rayyan-660618593	Diverse mini-batch Active Learning	2019	1	17						Zhdanov, Fedor	http://arxiv.org/abs/1901.05954	en	arXiv		no ER task		0	0	1	0	0	0	0	0	0	0	0	0	0	0	0	0	0	-	-
Excluded	gal_dropout_nodate	Manual Search Ren	No	Yes	No	rayyan-660618610	Dropout as a Bayesian Approximation: Representing Model Uncertainty in Deep Learning									Gal, Yarin and Ghahramani, Zoubin		en			no ER task		0	0	1	0	0	0	0	0	0	0	0	0	0	0	0	0	0	-	-
Excluded	srivastava_dropout_nodate	Manual Search Ren	No	Yes	No	rayyan-660618582	Dropout: A Simple Way to Prevent Neural Networks from Overﬁtting									Srivastava, Nitish and Hinton, Geoﬀrey and Krizhevsky, Alex and Sutskever, Ilya and Salakhutdinov, Ruslan		en			no ER task		0	0	1	0	0	0	0	0	0	0	0	0	0	0	0	0	0	-	-
Excluded	zhou_face_2017	Manual Search Ren	No	Yes	No	rayyan-660618630	Face Recognition via Heuristic Deep Active Learning	2017			Biometric Recognition	978-3-319-69922-6 978-3-319-69923-3	10568		97-107	Li, Ya and Wang, Keze and Nie, Lin and Wang, Qing and Zhou, Jie and Wang, Yunhong and Sun, Zhenan and Xu, Yong and Shen, Linlin and Feng, Jianjiang and Shan, Shiguang and Qiao, Yu and Guo, Zhenhua and Yu, Shiqi	http://link.springer.com/10.1007/978-3-319-69923-3_11		Springer International Publishing	Cham	no ER task		0	0	1	0	0	0	0	0	0	0	0	0	0	0	0	0	0	-	-
Excluded	farahani_facility_2009	Manual Search Ren	No	Yes	No	rayyan-660618621	Facility location: concepts, models, algorithms and case studies	2009								Farahani, Reza Zanjirani and Hekmatfar, Masoud	https://books.google.com/books?hl=de&lr=&id=a7JhwTwHveMC&oi=fnd&pg=PP6&dq=Reza+Zanjirani+Farahani+and+Masoud+Hekmatfar.+2009.+Facility+Location:+Concepts,+Models,+Algorithms+and+Case+Stud-+ies.+Springer&ots=iHDfrdOcvQ&sig=GagfAfDCY7p4SiM94_N0aXeReEw		Springer Science & Business Media		no ER task		0	0	1	0	0	0	0	0	0	0	0	0	0	0	0	0	0	-	-
Excluded	long_fully_2015	Manual Search Ren	No	Yes	No	rayyan-660618633	Fully convolutional networks for semantic segmentation	2015							3431-3440	Long, Jonathan and Shelhamer, Evan and Darrell, Trevor	http://openaccess.thecvf.com/content_cvpr_2015/html/Long_Fully_Convolutional_Networks_2015_CVPR_paper.html				no ER task		0	0	1	0	0	0	0	0	0	0	0	0	0	0	0	0	0	-	-
Excluded	zhu_generative_2017	Manual Search Ren	No	Yes	No	rayyan-660618661	Generative Adversarial Active Learning	2017	11	15						Zhu, Jia-Jie and Bento, José	http://arxiv.org/abs/1702.07956		arXiv		no ER task		0	0	1	0	0	0	0	0	0	0	0	0	0	0	0	0	0	-	-
Excluded	goodfellow_generative_2014	Manual Search Ren	No	Yes	No	rayyan-660618626	Generative adversarial nets	2014			Advances in neural information processing systems		27			Goodfellow, Ian and Pouget-Abadie, Jean and Mirza, Mehdi and Xu, Bing and Warde-Farley, David and Ozair, Sherjil and Courville, Aaron and Bengio, Yoshua	https://proceedings.neurips.cc/paper_files/paper/2014/hash/5ca3e9b122f61f8f06494c97b1afccf3-Abstract.html				no AL		0	0	0	0	1	0	0	0	0	0	0	0	0	0	0	0	0	-	-
Excluded	donoho_high-dimensional_2000	Manual Search Ren	No	Yes	No	rayyan-660618619	High-dimensional data analysis: The curses and blessings of dimensionality	2000			AMS math challenges lecture		1	2000	32	Donoho, David L.	https://sunju.org/teach/TMML-Fall-2021/Donoho-2000.pdf				no AL		0	0	0	0	1	0	0	0	0	0	0	0	0	0	0	0	0	-	-
Excluded	priya_identifying_2019	Manual Search Ren	No	Yes	No	rayyan-660618640	Identifying infrastructure damage during earthquake using deep active learning	2019							551-552	Priya, Shalini and Singh, Saharsh and Dandapat, Sourav Kumar and Ghosh, Kripabandhu and Chandra, Joydeep	https://dl.acm.org/doi/abs/10.1145/3341161.3342955				no ER task		0	0	1	0	0	0	0	0	0	0	0	0	0	0	0	0	0	-	-
Excluded	brinker_incorporating_nodate	Manual Search Ren	No	Yes	No	rayyan-660618600	Incorporating Diversity in Active Learning with Support Vector Machines									Brinker, Klaus		en			no ER task		0	0	1	0	0	0	0	0	0	0	0	0	0	0	0	0	0	-	-
Excluded	donahue_large_2019	Manual Search Ren	No	Yes	No	rayyan-660618618	Large scale adversarial representation learning	2019			Advances in neural information processing systems		32			Donahue, Jeff and Simonyan, Karen	https://proceedings.neurips.cc/paper_files/paper/2019/hash/18cdf49ea54eec029238fcc95f76ce41-Abstract.html				no ER task		0	0	1	0	0	0	0	0	0	0	0	0	0	0	0	0	0	-	-
Excluded	chitta_large-scale_2019	Manual Search Ren	No	Yes	No	rayyan-660618571	Large-Scale Visual Active Learning with Deep Probabilistic Ensembles	2019	2	20						Chitta, Kashyap and Alvarez, Jose M. and Lesnikowski, Adam	http://arxiv.org/abs/1811.03575	en	arXiv		no ER task		0	0	1	0	0	0	0	0	0	0	0	0	0	0	0	0	0	-	-
Excluded	fang_learning_2017-1	Manual Search Ren	Yes	No	No	rayyan-660618620	Learning how to Active Learn: A Deep Reinforcement Learning Approach	2017	8	8						Fang, Meng and Li, Yuan and Cohn, Trevor	http://arxiv.org/abs/1708.02383		arXiv		duplicate		1	0	0	0	0	0	0	0	0	0	0	0	0	0	0	0	0	-	-
Excluded	yoo_learning_2019	Manual Search Ren	No	Yes	No	rayyan-660618588	Learning Loss for Active Learning	2019	6	1	2019 IEEE/CVF Conference on Computer Vision and Pattern Recognition (CVPR)	978-1-72813-293-8			93-102	Yoo, Donggeun and Kweon, In So	https://ieeexplore.ieee.org/document/8954021/	en	IEEE		no ER task	10.1109/CVPR.2019.00018	0	0	1	0	0	0	0	0	0	0	0	0	0	0	0	0	0	-	-
Excluded	sohn_learning_2015	Manual Search Ren	No	Yes	No	rayyan-660618650	Learning structured output representation using deep conditional generative models	2015			Advances in neural information processing systems		28			Sohn, Kihyuk and Lee, Honglak and Yan, Xinchen	https://proceedings.neurips.cc/paper_files/paper/2015/hash/8d55a249e6baa5c06772297520da2051-Abstract.html				no ER task		0	0	1	0	0	0	0	0	0	0	0	0	0	0	0	0	0	-	-
Excluded	yang_leveraging_2018	Manual Search Ren	No	Yes	No	rayyan-660618565	Leveraging Crowdsourcing Data for Deep Active Learning An Application: Learning Intents in Alexa	2018			the 2018 World Wide Web Conference	978-1-4503-5639-8			23-32	Yang, Jie and Drake, Thomas and Damianou, Andreas and Maarek, Yoelle	http://dl.acm.org/citation.cfm?doid=3178876.3186033	en	ACM Press		no ER task	10.1145/3178876.3186033	0	0	1	0	0	0	0	0	0	0	0	0	0	0	0	0	0	-	-
Excluded	leibig_leveraging_2017	Manual Search Ren	No	Yes	No	rayyan-660618580	Leveraging uncertainty information from deep neural networks for disease detection	2017	12	19	Scientific Reports	2045-2322	7	1	17816	Leibig, Christian and Allken, Vaneeda and Ayhan, Murat Seçkin and Berens, Philipp and Wahl, Siegfried	https://www.nature.com/articles/s41598-017-17876-z	en			no ER task	10.1038/s41598-017-17876-z	0	0	1	0	0	0	0	0	0	0	0	0	0	0	0	0	0	-	-
Excluded	kasai_low-resource_2019	Manual Search Ren	No	Yes	No	rayyan-660618628	Low-resource Deep Entity Resolution with Transfer and Active Learning	2019	6	17						Kasai, Jungo and Qian, Kun and Gurajada, Sairam and Li, Yunyao and Popa, Lucian	http://arxiv.org/abs/1906.08042		arXiv		no ER task		0	0	1	0	0	0	0	0	0	0	0	0	0	0	0	0	0	-	-
Excluded	joshi_multi-class_2010	Manual Search Ren	No	Yes	No	rayyan-660618599	Multi-class batch-mode active learning for image classification	2010	5	1	2010 IEEE International Conference on Robotics and Automation (ICRA 2010)	978-1-4244-5038-1			1873-1878	Joshi, Ajay J. and Porikli, Fatih and Papanikolopoulos, Nikolaos	https://ieeexplore.ieee.org/document/5509293/	en	IEEE		no ER task	10.1109/ROBOT.2010.5509293	0	0	1	0	0	0	0	0	0	0	0	0	0	0	0	0	0	-	-
Excluded	saquil_ranking_2018	Manual Search Ren	No	Yes	No	rayyan-660618587	Ranking CGANs: Subjective Control over Semantic Image Attributes	2018	7	24						Saquil, Yassir and Kim, Kwang In and Hall, Peter	http://arxiv.org/abs/1804.04082	en	arXiv		no ER task		0	0	1	0	0	0	0	0	0	0	0	0	0	0	0	0	0	-	-
Excluded	simeoni_rethinking_2021	Manual Search Ren	No	Yes	No	rayyan-660618649	Rethinking deep active learning: Using unlabeled data at model training	2021							1220-1227	Siméoni, Oriane and Budnik, Mateusz and Avrithis, Yannis and Gravier, Guillaume	https://ieeexplore.ieee.org/abstract/document/9412716/		IEEE		no ER task		0	0	1	0	0	0	0	0	0	0	0	0	0	0	0	0	0	-	-
Excluded	descoteaux_suggestive_2017	Manual Search Ren	No	Yes	No	rayyan-660618657	Suggestive Annotation: A Deep Active Learning Framework for Biomedical Image Segmentation	2017			Medical Image Computing and Computer Assisted Intervention − MICCAI 2017	978-3-319-66178-0 978-3-319-66179-7	10435		399-407	Yang, Lin and Zhang, Yizhe and Chen, Jianxu and Zhang, Siyuan and Chen, Danny Z. and Descoteaux, Maxime and Maier-Hein, Lena and Franz, Alfred and Jannin, Pierre and Collins, D. Louis and Duchesne, Simon	https://link.springer.com/10.1007/978-3-319-66179-7_46	en	Springer International Publishing	Cham	no ER task		0	0	1	0	0	0	0	0	0	0	0	0	0	0	0	0	0	-	-
Excluded	tong_support_nodate	Manual Search Ren	No	Yes	No	rayyan-660618606	Support Vector Machine Active Learning with Applications to Text Classiﬁcation									Tong, Simon and Koller, Daphne		en			no ER task		0	0	1	0	0	0	0	0	0	0	0	0	0	0	0	0	0	-	-
Excluded	kim_task-aware_2021	Manual Search Ren	No	Yes	No	rayyan-660618589	Task-Aware Variational Adversarial Active Learning	2021	6	1	2021 IEEE/CVF Conference on Computer Vision and Pattern Recognition (CVPR)	978-1-66544-509-2			8162-8171	Kim, Kwanyoung and Park, Dongwon and Kim, Kwang In and Chun, Se Young	https://ieeexplore.ieee.org/document/9578438/	en	IEEE		no ER task	10.1109/CVPR46437.2021.00807	0	0	1	0	0	0	0	0	0	0	0	0	0	0	0	0	0	-	-
Excluded	beluch_power_2018	Manual Search Ren	No	Yes	No	rayyan-660618559	The Power of Ensembles for Active Learning in Image Classification	2018	6	1	2018 IEEE/CVF Conference on Computer Vision and Pattern Recognition (CVPR)	978-1-5386-6420-9			9368-9377	Beluch, William H. and Genewein, Tim and Nurnberger, Andreas and Kohler, Jan M.	https://ieeexplore.ieee.org/document/8579074/	en	IEEE		no ER task	10.1109/CVPR.2018.00976	0	0	1	0	0	0	0	0	0	0	0	0	0	0	0	0	0	-	-
Excluded	zeng_relevance_2018	Manual Search Ren	No	Yes	No	rayyan-660618564	The Relevance of Bayesian Layer Positioning to Model Uncertainty in Deep Bayesian Active Learning	2018	11	29						Zeng, Jiaming and Lesnikowski, Adam and Alvarez, Jose M.	http://arxiv.org/abs/1811.12535	en	arXiv		no ER task		0	0	1	0	0	0	0	0	0	0	0	0	0	0	0	0	0	-	-
Excluded	martinez-arellano_towards_2019	Manual Search Ren	No	Yes	No	rayyan-660618568	Towards An Active Learning Approach To Tool Condition Monitoring With Bayesian Deep Learning	2019	6	14	33rd International ECMS Conference on Modelling and Simulation	978-3-937436-65-4			223-229	Martinez-Arellano, Giovanna and Ratchev, Svetan	http://www.scs-europe.net/dlib/2019/2019-0223.htm	en	ECMS		no ER task	10.7148/2019-0223	0	0	1	0	0	0	0	0	0	0	0	0	0	0	0	0	0	-	-
Excluded	he_towards_2019	Manual Search Ren	No	Yes	No	rayyan-660618605	Towards Better Uncertainty Sampling: Active Learning with Multiple Views for Deep Convolutional Neural Network	2019	7	1	2019 IEEE International Conference on Multimedia and Expo (ICME)	978-1-5386-9552-4			1360-1365	He, Tao and Jin, Xiaoming and Ding, Guiguang and Yi, Lan and Yan, Chenggang	https://ieeexplore.ieee.org/document/8784806/	en	IEEE		no ER task	10.1109/ICME.2019.00236	0	0	1	0	0	0	0	0	0	0	0	0	0	0	0	0	0	-	-
Excluded	munjal_towards_2022	Manual Search Ren	No	Yes	No	rayyan-660618637	Towards robust and reproducible active learning using neural networks	2022							223-232	Munjal, Prateek and Hayat, Nasir and Hayat, Munawar and Sourati, Jamshid and Khan, Shadab	http://openaccess.thecvf.com/content/CVPR2022/html/Munjal_Towards_Robust_and_Reproducible_Active_Learning_Using_Neural_Networks_CVPR_2022_paper.html				no ER task		0	0	1	0	0	0	0	0	0	0	0	0	0	0	0	0	0	-	-
Excluded	chitta_training_2022	Manual Search Ren	No	Yes	No	rayyan-660618560	Training Data Subset Search With Ensemble Active Learning	2022	9		IEEE Transactions on Intelligent Transportation Systems	1524-9050, 1558-0016	23	9	14741-14752	Chitta, Kashyap and Alvarez, Jose M. and Haussmann, Elmar and Farabet, Clement	https://ieeexplore.ieee.org/document/9667339/	en			no ER task	10.1109/TITS.2021.3133268	0	0	1	0	0	0	0	0	0	0	0	0	0	0	0	0	0	-	-
Excluded	navab_u-net_2015	Manual Search Ren	No	Yes	No	rayyan-660618642	U-Net: Convolutional Networks for Biomedical Image Segmentation	2015			Medical Image Computing and Computer-Assisted Intervention – MICCAI 2015	978-3-319-24573-7 978-3-319-24574-4	9351		234-241	Ronneberger, Olaf and Fischer, Philipp and Brox, Thomas and Navab, Nassir and Hornegger, Joachim and Wells, William M. and Frangi, Alejandro F.	http://link.springer.com/10.1007/978-3-319-24574-4_28	en	Springer International Publishing	Cham	no ER task		0	0	1	0	0	0	0	0	0	0	0	0	0	0	0	0	0	-	-
Excluded	chang_using_2020-3	Manual Search Ren	Yes	No	No	rayyan-660618617	Using error decay prediction to overcome practical issues of deep active learning for named entity recognition	2020	9		Machine Learning	0885-6125, 1573-0565	109	9	1749-1778	Chang, Haw-Shiuan and Vembu, Shankar and Mohan, Sunil and Uppaal, Rheeya and McCallum, Andrew	https://link.springer.com/10.1007/s10994-020-05897-1	en			duplicate	10.1007/s10994-020-05897-1	1	0	0	0	0	0	0	0	0	0	0	0	0	0	0	0	0	-	-
Excluded	sinha_variational_2019	Manual Search Ren	No	Yes	No	rayyan-660618586	Variational Adversarial Active Learning	2019	10	1	2019 IEEE/CVF International Conference on Computer Vision (ICCV)	978-1-72814-803-8			5971-5980	Sinha, Samrath and Ebrahimi, Sayna and Darrell, Trevor	https://ieeexplore.ieee.org/document/9009538/	en	IEEE		no ER task	10.1109/ICCV.2019.00607	0	0	1	0	0	0	0	0	0	0	0	0	0	0	0	0	0	-	-
Excluded	srivastava_veegan_nodate	Manual Search Ren	No	Yes	No	rayyan-660618575	VEEGAN: Reducing Mode Collapse in GANs using Implicit Variational Learning									Srivastava, Akash and Valkov, Lazar and Russell, Chris and Gutmann, Michael U and Sutton, Charles		en			no ER task		0	0	1	0	0	0	0	0	0	0	0	0	0	0	0	0	0	-	-
Excluded	culotta_reducing_2005-2	Manual Search Zhang	Yes	No	No	rayyan-661573134	Reducing labeling effort for structured prediction tasks	2005					5		746-751	Culotta, Aron and McCallum, Andrew	https://cdn.aaai.org/AAAI/2005/AAAI05-117.pdf				duplicate		1	0	0	0	0	0	0	0	0	0	0	0	0	0	0	0	0	-	-
Excluded	shen_deep_2018-1	Manual Search Zhang	Yes	No	No	rayyan-661573135	Deep Active Learning for Named Entity Recognition	2018	2	3						Shen, Yanyao and Yun, Hyokun and Lipton, Zachary C. and Kronrod, Yakov and Anandkumar, Animashree	http://arxiv.org/abs/1707.05928		arXiv		duplicate		1	0	0	0	0	0	0	0	0	0	0	0	0	0	0	0	0	-	-
Excluded	shelmanov_active_2021-1	Manual Search Zhang	Yes	No	No	rayyan-661573136	Active Learning for Sequence Tagging with Deep Pre-trained Models and Bayesian Uncertainty Estimates	2021	2	18						Shelmanov, Artem and Puzyrev, Dmitri and Kupriyanova, Lyubov and Belyakov, Denis and Larionov, Daniil and Khromov, Nikita and Kozlova, Olga and Artemova, Ekaterina and Dylov, Dmitry V. and Panchenko, Alexander	http://arxiv.org/abs/2101.08133		arXiv		duplicate		1	0	0	0	0	0	0	0	0	0	0	0	0	0	0	0	0	-	-
Excluded	settles_analysis_2008-2	Manual Search Zhang	Yes	No	No	rayyan-661573137	An analysis of active learning strategies for sequence labeling tasks	2008							1070-1079	Settles, Burr and Craven, Mark	https://aclanthology.org/D08-1112.pdf				duplicate		1	0	0	0	0	0	0	0	0	0	0	0	0	0	0	0	0	-	-
Excluded	chang_using_2020-2	Manual Search Zhang	Yes	No	No	rayyan-661573138	Using error decay prediction to overcome practical issues of deep active learning for named entity recognition	2020	9		Machine Learning	0885-6125, 1573-0565	109	9	1749-1778	Chang, Haw-Shiuan and Vembu, Shankar and Mohan, Sunil and Uppaal, Rheeya and McCallum, Andrew	https://link.springer.com/10.1007/s10994-020-05897-1	en			duplicate	10.1007/s10994-020-05897-1	1	0	0	0	0	0	0	0	0	0	0	0	0	0	0	0	0	-	-
Excluded	shen_multi-criteria-based_2004-2	Manual Search Zhang	Yes	No	No	rayyan-661573139	Multi-criteria-based active learning for named entity recognition	2004							589-596	Shen, Dan and Zhang, Jie and Su, Jian and Zhou, Guodong and Tan, Chew Lim	https://aclanthology.org/P04-1075.pdf				duplicate		1	0	0	0	0	0	0	0	0	0	0	0	0	0	0	0	0	-	-
Excluded	kim_mmr-based_2006-2	Manual Search Zhang	Yes	No	No	rayyan-661573140	Mmr-based active machine learning for bio named entity recognition	2006							69-72	Kim, Seokhwan and Song, Yu and Kim, Kyungduk and Cha, Jeong-Won and Lee, Gary Geunbae	https://aclanthology.org/N06-2018.pdf				duplicate		1	0	0	0	0	0	0	0	0	0	0	0	0	0	0	0	0	-	-
Excluded	tomanek_semi-supervised_2009-1	Manual Search Zhang	Yes	No	No	rayyan-661573141	Semi-supervised active learning for sequence labeling	2009							1039-1047	Tomanek, Katrin and Hahn, Udo	https://aclanthology.org/P09-1117.pdf				duplicate		1	0	0	0	0	0	0	0	0	0	0	0	0	0	0	0	0	-	-
Excluded	marcheggiani_experimental_2014-1	Manual Search Zhang	Yes	No	No	rayyan-661573142	An experimental comparison of active learning strategies for partially labeled sequences	2014							898-906	Marcheggiani, Diego and Artieres, Thierry	https://aclanthology.org/D14-1097.pdf				duplicate		1	0	0	0	0	0	0	0	0	0	0	0	0	0	0	0	0	-	-
Excluded	chen_study_2015-2	Manual Search Zhang	Yes	No	No	rayyan-661573143	A study of active learning methods for named entity recognition in clinical text	2015			Journal of biomedical informatics		58		11-18	Chen, Yukun and Lasko, Thomas A. and Mei, Qiaozhu and Denny, Joshua C. and Xu, Hua	https://www.sciencedirect.com/science/article/pii/S1532046415002038				duplicate		1	0	0	0	0	0	0	0	0	0	0	0	0	0	0	0	0	-	-
Excluded	li_proactive_2017-1	Manual Search Zhang	Yes	No	No	rayyan-661573144	Proactive learning for named entity recognition	2017							117-125	Li, Maolin and Nguyen, Nhung and Ananiadou, Sophia	https://aclanthology.org/W17-2314/				duplicate		1	0	0	0	0	0	0	0	0	0	0	0	0	0	0	0	0	-	-
Included	siddhant_deep_2018	Manual Search Zhang	No	No	No	rayyan-661573145	Deep Bayesian Active Learning for Natural Language Processing: Results of a Large-Scale Empirical Study	2018	9	24						Siddhant, Aditya and Lipton, Zachary C.	http://arxiv.org/abs/1808.05697		arXiv		""		0	0	0	0	0	0	0	0	0	0	0	0	0	0	0	0	0	-	-
Excluded	erdmann_practical_2019-1	Manual Search Zhang	Yes	No	No	rayyan-661573146	Practical, efficient, and customizable active learning for named entity recognition in the digital humanities	2019								Erdmann, Alexander and Wrisley, David Joseph and Brown, Christopher and Cohen-Bodénès, Sophie and Elsner, Micha and Feng, Yukun and Joseph, Brian and Joyeux-Prunel, Béatrice and de Marneffe, Marie-Catherine	http://archive.nyu.edu/handle/2451/60381		Association for Computational Linguistics		duplicate		1	0	0	0	0	0	0	0	0	0	0	0	0	0	0	0	0	-	-
Excluded	chaudhary_little_2019-1	Manual Search Zhang	Yes	No	No	rayyan-661573147	A Little Annotation does a Lot of Good: A Study in Bootstrapping Low-resource Named Entity Recognizers	2019	8	23						Chaudhary, Aditi and Xie, Jiateng and Sheikh, Zaid and Neubig, Graham and Carbonell, Jaime G.	http://arxiv.org/abs/1908.08983		arXiv		duplicate		1	0	0	0	0	0	0	0	0	0	0	0	0	0	0	0	0	-	-
Excluded	brantley_active_2020-1	Manual Search Zhang	Yes	No	No	rayyan-661573148	Active Imitation Learning with Noisy Guidance	2020	5	26						Brantley, Kianté and Sharaf, Amr and Daumé III, Hal	http://arxiv.org/abs/2005.12801		arXiv		duplicate		1	0	0	0	0	0	0	0	0	0	0	0	0	0	0	0	0	-	-
Excluded	hazra_active2_2021-1	Manual Search Zhang	Yes	No	No	rayyan-661573149	Active^2 Learning: Actively reducing redundancies in Active Learning methods for Sequence Tagging and Machine Translation	2021	6	1	NAACL-HLT 2021				1982-1995	Hazra, Rishi and Dutta, Parag and Gupta, Shubham and Qaathir, Mohammed Abdul and Dukkipati, Ambedkar and Toutanova, Kristina and Rumshisky, Anna and Zettlemoyer, Luke and Hakkani-Tur, Dilek and Beltagy, Iz and Bethard, Steven and Cotterell, Ryan and Chakraborty, Tanmoy and Zhou, Yichao	https://aclanthology.org/2021.naacl-main.159		Association for Computational Linguistics		duplicate	10.18653/v1/2021.naacl-main.159	1	0	0	0	0	0	0	0	0	0	0	0	0	0	0	0	0	-	-
Excluded	radmard_subsequence_2021-1	Manual Search Zhang	Yes	No	No	rayyan-661573150	Subsequence based deep active learning for named entity recognition	2021							4310-4321	Radmard, Puria and Fathullah, Yassir and Lipani, Aldo	https://aclanthology.org/2021.acl-long.332/				duplicate		1	0	0	0	0	0	0	0	0	0	0	0	0	0	0	0	0	-	-
Excluded	dossou_afrolm_2022	Manual Search Zhang	No	Yes	No	rayyan-661573151	AfroLM: A Self-Active Learning-based Multilingual Pretrained Language Model for 23 African Languages	2022	11	23						Dossou, Bonaventure F. P. and Tonja, Atnafu Lambebo and Yousuf, Oreen and Osei, Salomey and Oppong, Abigail and Shode, Iyanuoluwa and Awoyomi, Oluwabusayo Olufunke and Emezue, Chris Chinenye	http://arxiv.org/abs/2211.03263		arXiv		dataset not latin written		0	0	0	1	0	0	0	0	0	0	0	0	0	0	0	0	0	-	-
Excluded	wang_wetland_2011	Scopus	No	Yes	No	rayyan-658289598	Wetland information extraction from RS image based on wavelet packet and the active learning support vector machine	2011			IFIP Advances in Information and Communication Technology		346		491-499	Wang, P. and Bao, W.	https://www.scopus.com/inward/record.uri?eid=2-s2.0-79951596215&doi=10.1007%2f978-3-642-18354-6_58&partnerID=40&md5=b68ca877b9e112d055ef4458834914d4				no ER task	10.1007/978-3-642-18354-6_58	0	0	1	0	0	0	0	0	0	0	0	0	0	0	0	0	0	-	-
Excluded	ma_word_2021	Scopus	No	Yes	No	rayyan-658289509	Word Embedding Bootstrapped Deep Active Learning Method to Information Extraction on Chinese Electronic Medical Record	2021			Journal of Shanghai Jiaotong University (Science)		26	4	494-502	Ma, Q. and Cen, X. and Yuan, J. and Hou, X.	https://www.scopus.com/inward/record.uri?eid=2-s2.0-85103430403&doi=10.1007%2fs12204-021-2285-5&partnerID=40&md5=d5743b2050189cb61d2d65d5177e9ac1				dataset not latin written	10.1007/s12204-021-2285-5	0	0	0	1	0	0	0	0	0	0	0	0	0	0	0	0	0	-	-
Excluded	morton_wordfreak_2003-1	Scopus	No	Yes	No	rayyan-658289712	WordFreak: An open tool for linguistic annotation	2003			Proceedings of the 2003 Human Language Technology Conference of the North American Chapter of the Association for Computational Linguistics - Demonstrations, HLT-NAACL 2003				17-18	Morton, T. and LaCivita, J.	https://www.scopus.com/inward/record.uri?eid=2-s2.0-71749085142&partnerID=40&md5=79996bdb52a2f37be39495127343732c				no AL		0	0	0	0	1	0	0	0	0	0	0	0	0	0	0	0	0	-	-
Excluded	lin_continuous_2020-1	ACM	Yes	No	No	rayyan-664250236	A continuous learning method for recognizing named entities by integrating domain contextual relevance measurement and Web farming mode of Web intelligence	2020	5		World Wide Web-internet and Web Information Systems	1386-145X	23	3	1769-1790	Lin, Shaofu and Gao, Jiangfan and Zhang, Shun and He, Xiaobo and Sheng, Ying and Chen, Jianhui	https://doi.org/10.1007/s11280-019-00758-x				duplicate	10.1007/s11280-019-00758-x	1	0	0	0	0	0	0	0	0	0	0	0	0	0	0	0	0	-	-
Excluded	li_framework_2021-1	ACM	Yes	No	No	rayyan-664250258	A framework of data augmentation while active learning for chinese named entity recognition	2021				978-3-030-82146-3			88-100	Li, Qingqing and Huang, Zhen and Dou, Yong and Zhang, Ziwen	https://doi.org/10.1007/978-3-030-82147-0_8		Springer-Verlag		duplicate	10.1007/978-3-030-82147-0_8	1	0	0	0	0	0	0	0	0	0	0	0	0	0	0	0	0	-	-
Excluded	lucarelli_greek_2006-1	ACM	Yes	No	No	rayyan-664250280	A greek named-entity recognizer that uses support vector machines and active learning	2006				3-540-34117-X			203-213	Lucarelli, Georgios and Androutsopoulos, Ion	https://doi.org/10.1007/11752912_22		Springer-Verlag		duplicate	10.1007/11752912_22	1	0	0	0	0	0	0	0	0	0	0	0	0	0	0	0	0	-	-
Excluded	huang_low-cost_2018-1	ACM	Yes	No	No	rayyan-664250275	A low-cost named entity recognition research based on active learning	2018	1	1	Sci. Program.	1058-9244	2018			Huang, Han and Wang, Hongyu and Jin, Dawei and García-Díaz, Vicente	https://doi.org/10.1155/2018/1890683				duplicate	10.1155/2018/1890683	1	0	0	0	0	0	0	0	0	0	0	0	0	0	0	0	0	-	-
Excluded	boiy_machine_2009	ACM	Yes	No	No	rayyan-664250328	A machine learning approach to sentiment analysis in multilingual Web texts	2009	10	1	Inf. Retr.	1386-4564	12	5	526-558	Boiy, Erik and Moens, Marie-Francine	https://doi.org/10.1007/s10791-008-9070-z				duplicate	10.1007/s10791-008-9070-z	1	0	0	0	0	0	0	0	0	0	0	0	0	0	0	0	0	-	-
